🚀 文档优化系统启动
==================

优化目录: /root/.openclaw/workspace/As-my-see/docs
────────────
优化: 自定义rqt插件.md
  ✅ 优化完成 (+17 字节)
优化: 1_Qt.md
  ✅ 优化完成 (+-88 字节)
优化: 3_Qt核心特点.md
  ✅ 优化完成 (+25 字节)
优化: 4_对象树.md
  ✅ 优化完成 (+29 字节)
优化: 5_Lambda表达式.md
  ✅ 优化完成 (+19 字节)
优化: 5_Lambda表达式_qt.md
  ✅ 优化完成 (+32 字节)
优化: 6_QMainWindow菜单栏.md
  ✅ 优化完成 (+17 字节)
优化: 8_对话框.md
  ✅ 优化完成 (+24 字节)
优化: 9_自定义控件.md
  ✅ 优化完成 (+34 字节)
优化: Containers控件们.md
  ✅ 优化完成 (+27 字节)
  进度: 10 个文件
优化: Display Widgets控件.md
  ✅ 优化完成 (+30 字节)
优化: Input Widgets控件.md
  ✅ 优化完成 (+29 字节)
优化: LineEdit控件.md
  ✅ 优化完成 (+33 字节)
优化: SpaceItem弹簧控件.md
  ✅ 优化完成 (+33 字节)
优化: TextEdit控件.md
  ✅ 优化完成 (+23 字节)
优化: Widget控件.md
  ✅ 优化完成 (+30 字节)
优化: 按钮控件.md
  ✅ 优化完成 (+32 字节)
优化: 1_Qt_1.md
  ✅ 优化完成 (+-88 字节)
优化: 3_Qt核心特点_1.md
  ✅ 优化完成 (+25 字节)
优化: 4_对象树_1.md
  ✅ 优化完成 (+29 字节)
  进度: 20 个文件
优化: 5_Lambda表达式_1.md
  ✅ 优化完成 (+19 字节)
优化: 5_Lambda表达式_qt_1.md
  ✅ 优化完成 (+32 字节)
优化: 6_QMainWindow菜单栏_1.md
  ✅ 优化完成 (+17 字节)
优化: 8_对话框_1.md
  ✅ 优化完成 (+24 字节)
优化: 9_自定义控件_1.md
  ✅ 优化完成 (+34 字节)
优化: Containers控件们_1.md
  ✅ 优化完成 (+27 字节)
优化: Display Widgets控件_1.md
  ✅ 优化完成 (+30 字节)
优化: Input Widgets控件_1.md
  ✅ 优化完成 (+29 字节)
优化: LineEdit控件_1.md
  ✅ 优化完成 (+33 字节)
优化: SpaceItem弹簧控件_1.md
  ✅ 优化完成 (+33 字节)
  进度: 30 个文件
优化: TextEdit控件_1.md
  ✅ 优化完成 (+23 字节)
优化: Widget控件_1.md
  ✅ 优化完成 (+30 字节)
优化: 按钮控件_1.md
  ✅ 优化完成 (+32 字节)
优化: C++多线程.md
  ✅ 优化完成 (+46 字节)
优化: C++游戏编程.md
  ✅ 优化完成 (+29 字节)
优化: C++游戏编程_1.md
  ✅ 优化完成 (+29 字节)
优化: Linux软链接、硬链接.md
  ✅ 优化完成 (+63 字节)
优化: Shell脚本.md
  ✅ 优化完成 (+50 字节)
优化: 内存寻址6_Linux中的分页.md
  ✅ 优化完成 (+19 字节)
优化: Fusion360脚本导出URDF.md
  ✅ 优化完成 (+21 字节)
  进度: 40 个文件
优化: shell脚本.md
  ✅ 优化完成 (+-35 字节)
优化: Linux下的can编程.md
  ✅ 优化完成 (+33 字节)
优化: ubuntu20.04 server通过配置网卡连接wifi.md
  ✅ 优化完成 (+83 字节)
优化: ubuntu20.04更换n卡驱动后无法调节亮度.md
  ✅ 优化完成 (+87 字节)
优化: ubuntu20.04网线连接校园网.md
  ✅ 优化完成 (+35 字节)
优化: 建立SSH.md
  ✅ 优化完成 (+32 字节)
优化: PID控制.md
  ✅ 优化完成 (+16 字节)
优化: 建立控制器.md
  ✅ 优化完成 (+28 字节)
优化: 开环控制算法.md
  ✅ 优化完成 (+33 字节)
优化: 机器人路径规划与轨迹优化.md
  ✅ 优化完成 (+0 字节)
  进度: 50 个文件
优化: GM6020云台电机.md
  ✅ 优化完成 (+17 字节)
优化: PID控制器.md
  ✅ 优化完成 (+1 字节)
优化: 控制器注册为插件.md
  ✅ 优化完成 (+61 字节)
优化: 控制组学习清单.md
  ✅ 优化完成 (+33 字节)
优化: 机器人比赛中常用的底盘轮系简介.md
  ✅ 优化完成 (+27 字节)
优化: 关于调电机.md
  ✅ 优化完成 (+53 字节)
优化: 电机说明.md
  ✅ 优化完成 (+32 字节)
优化: 传感器数据分析.md
  ✅ 优化完成 (+30 字节)
优化: 惯性传感器（IMU）.md
  ✅ 优化完成 (+21 字节)
优化: 插件&控制器.md
  ✅ 优化完成 (+19 字节)
  进度: 60 个文件
优化: 机器人动力学—拉格朗日法.md
  ✅ 优化完成 (+-2 字节)
优化: 动力学推导.md
  ✅ 优化完成 (+53 字节)
优化: 正逆运动学.md
  ✅ 优化完成 (+29 字节)
优化: 麦克拉姆轮的运动学分析.md
  ✅ 优化完成 (+29 字节)
优化: SLAM的基本知识.md
  ✅ 优化完成 (+19 字节)
优化: 控制器们——chasis.md
  ✅ 优化完成 (+15 字节)
优化: 控制器的信息获取.md
  ✅ 优化完成 (+32 字节)
优化: 在一切一切之前（新控制队员入队之后的一些必要内容）.md
  ✅ 优化完成 (+103 字节)
优化: 测云台电机反应速度.md
  ✅ 优化完成 (+65 字节)
优化: ROS学习.md
  ✅ 优化完成 (+-7 字节)
  进度: 70 个文件
优化: ROS激光雷达建图导航.md
  ✅ 优化完成 (+1 字节)
优化: ROS激光雷达建图导航2.md
  ✅ 优化完成 (+10 字节)
优化: ROS编程.md
  ✅ 优化完成 (+9 字节)
优化: ROS通信_dev.md
  ✅ 优化完成 (+6 字节)
优化: TF2.md
  ✅ 优化完成 (+25 字节)
优化: URDF.md
  ✅ 优化完成 (+20 字节)
优化: URDFTransmission.md
  ✅ 优化完成 (+11 字节)
优化: ros_control.md
  ✅ 优化完成 (+-86 字节)
优化: ros_control补充解析.md
  ✅ 优化完成 (+16 字节)
优化: 将ROS和STM32连接.md
  ✅ 优化完成 (+35 字节)
  进度: 80 个文件
优化: 建模导出URDF.md
  ✅ 优化完成 (+8 字节)
优化: URDF_1.md
  ✅ 优化完成 (+21 字节)
优化: Unity + ROS.md
  ✅ 优化完成 (+37 字节)
优化: ros control.md
  ✅ 优化完成 (+27 字节)
优化: 使用rosdepc.md
  ✅ 优化完成 (+48 字节)
优化: 基础概念：坐标系（TF）.md
  ✅ 优化完成 (+-35 字节)
优化: clion配置ros2开发环境.md
  ✅ 优化完成 (+29 字节)
优化: docker开发ros2.md
  ✅ 优化完成 (+47 字节)
优化: ros2 note.md
  ✅ 优化完成 (+48 字节)
优化: 编写ros2 controller.md
  ✅ 优化完成 (+59 字节)
  进度: 90 个文件
优化: URDF and Git pre-commit gitignore学习历程.md
  ✅ 优化完成 (+70 字节)
优化: rosbag.md
  ✅ 优化完成 (+44 字节)
优化: URDF and Git pre-commit gitignore学习历程_1.md
  ✅ 优化完成 (+72 字节)
优化: 形态学处理.md
  ✅ 优化完成 (+48 字节)
优化: 色彩分割.md
  ✅ 优化完成 (+50 字节)
优化: Socketcan.md
  ✅ 优化完成 (+32 字节)
优化: CAN命令.md
  ✅ 优化完成 (+27 字节)
优化: CAN总线 1.md
  ✅ 优化完成 (+9 字节)
优化: CAN编程(2).md
  ✅ 优化完成 (+28 字节)
优化: CAN编程.md
  ✅ 优化完成 (+32 字节)
  进度: 100 个文件
优化: EtherCAT工业以太网通信.md
  ✅ 优化完成 (+3 字节)
优化: can-utils.md
  ✅ 优化完成 (+23 字节)
优化: can总线.md
  ✅ 优化完成 (+22 字节)
优化: socketcan.md
  ✅ 优化完成 (+16 字节)
优化: socketcan数据传输.md
  ✅ 优化完成 (+17 字节)
优化: 关于CAN通信.md
  ✅ 优化完成 (+33 字节)
优化: Arduino基础.md
  ✅ 优化完成 (+18 字节)
优化: can_bus.md
  ✅ 优化完成 (+43 字节)
优化: socketcan_1.md
  ✅ 优化完成 (+46 字节)
优化: 代码库CAN.md
  ✅ 优化完成 (+28 字节)
  进度: 110 个文件
优化: actuator_coefficient.md
  ✅ 优化完成 (+57 字节)
优化: open函数.md
  ✅ 优化完成 (+33 字节)
优化: 内存寻址1_地址.md
  ✅ 优化完成 (+11 字节)
优化: 内存寻址2_分段.md
  ✅ 优化完成 (+30 字节)
优化: 内存寻址3_描述符表.md
  ✅ 优化完成 (+25 字节)
优化: 内存寻址4_分页.md
  ✅ 优化完成 (+16 字节)
优化: 内存寻址5_硬件高速缓存.md
  ✅ 优化完成 (+18 字节)
优化: 内存寻址7_物理内存.md
  ✅ 优化完成 (+30 字节)
优化: 内存寻址8_进程页表.md
  ✅ 优化完成 (+31 字节)
优化: 虚拟地址、逻辑地址、线性地址、物理地址的区别.md
  ✅ 优化完成 (+35 字节)
  进度: 120 个文件
优化: 1_前言.md
  ✅ 优化完成 (+35 字节)
优化: ESP8266_arduino.md
  ✅ 优化完成 (+10 字节)
优化: Nanopi开发板.md
  ✅ 优化完成 (+17 字节)
优化: PID的程序优化.md
  ✅ 优化完成 (+29 字节)
优化: PID算法的程序流程.md
  ✅ 优化完成 (+54 字节)
优化: PWM与力矩指令转换.md
  ✅ 优化完成 (+33 字节)
优化: Webots建模仿真.md
  ✅ 优化完成 (+35 字节)
优化: class RealtimeBuffer.md
  ✅ 优化完成 (+34 字节)
优化: class RealtimePublisher.md
  ✅ 优化完成 (+33 字节)
优化: 动态调参.md
  ✅ 优化完成 (+24 字节)
  进度: 130 个文件
优化: 句柄.md
  ✅ 优化完成 (+32 字节)
优化: 深度相机.md
  ✅ 优化完成 (+28 字节)
优化: rm_digtialimg_proc.md
  ✅ 优化完成 (+53 字节)
优化: Cmake install.md
  ✅ 优化完成 (+31 字节)
优化: Cmake 常用变量.md
  ✅ 优化完成 (+35 字节)
优化: Cmake 常见问题.md
  ✅ 优化完成 (+32 字节)
优化: Cmake 结构.md
  ✅ 优化完成 (+-13 字节)
优化: Github工作流程.md
  ✅ 优化完成 (+57 字节)
优化: Yaml指令.md
  ✅ 优化完成 (+20 字节)
优化: Adjust_chassis_power.md
  ✅ 优化完成 (+34 字节)
  进度: 140 个文件
优化: DJI遥控校准.md
  ✅ 优化完成 (+53 字节)
优化: IMU零飘补偿.md
  ✅ 优化完成 (+35 字节)
优化: shoot test.md
  ✅ 优化完成 (+26 字节)
优化: 手眼标定.md
  ✅ 优化完成 (+40 字节)
优化: 相机、imu联合标定.md
  ✅ 优化完成 (+19 字节)
优化: 相机标定.md
  ✅ 优化完成 (+50 字节)
优化: 自启.md
  ✅ 优化完成 (+44 字节)
优化: 自瞄.md
  ✅ 优化完成 (+42 字节)
优化: rm2_controls.md
  ✅ 优化完成 (+2 字节)
优化: study note.md
  ✅ 优化完成 (+48 字节)
  进度: 150 个文件
优化: GPIO.md
  ✅ 优化完成 (+40 字节)
优化: IMU.md
  ✅ 优化完成 (+30 字节)
优化: Kill Gazebo.md
  ✅ 优化完成 (+33 字节)
优化: PC使用gpio.md
  ✅ 优化完成 (+48 字节)
优化: engineer_middleware.md
  ✅ 优化完成 (+58 字节)
优化: gazebo中运行相机.md
  ✅ 优化完成 (+59 字节)
优化: github.io.md
  ✅ 优化完成 (+42 字节)
优化: map_odom_baselink.md
  ✅ 优化完成 (+35 字节)
优化: unordered_map容器.md
  ✅ 优化完成 (+56 字节)
优化: 如何编写controller.md
  ✅ 优化完成 (+58 字节)
  进度: 160 个文件
优化: 宏.md
  ✅ 优化完成 (+41 字节)
优化: 导航.md
  ✅ 优化完成 (+35 字节)
优化: 底盘轮系的速度计算（全向轮）.md
  ✅ 优化完成 (+26 字节)
优化: 底盘轮系的速度计算（舵轮）.md
  ✅ 优化完成 (+31 字节)
优化: 底盘轮系的速度计算（麦克纳姆轮）.md
  ✅ 优化完成 (+30 字节)
优化: 开发日常.md
  ✅ 优化完成 (+49 字节)
优化: 气动发射.md
  ✅ 优化完成 (+49 字节)
优化: 编码器.md
  ✅ 优化完成 (+30 字节)
优化: 自定义硬件接口.md
  ✅ 优化完成 (+58 字节)
优化: 踩坑日记.md
  ✅ 优化完成 (+50 字节)
  进度: 170 个文件
优化: bind()和connect()函数.md
  ✅ 优化完成 (+24 字节)
优化: boostbind()函数.md
  ✅ 优化完成 (+33 字节)
优化: ioctl()函数.md
  ✅ 优化完成 (+21 字节)
优化: socket() 函数.md
  ✅ 优化完成 (+53 字节)
优化: write()和read()函数.md
  ✅ 优化完成 (+35 字节)
优化: 字符串模糊匹配.md
  ✅ 优化完成 (+35 字节)
优化: 滤波函数.md
  ✅ 优化完成 (+33 字节)
优化: 无人机总览.md
  ✅ 优化完成 (+15 字节)
优化: 有助于检测电脑的一些命令行命令.md
  ✅ 优化完成 (+35 字节)
优化: 远程拉取.md
  ✅ 优化完成 (+21 字节)
  进度: 180 个文件
优化: WBC.md
  ✅ 优化完成 (+24 字节)
优化: 底盘轮系介绍.md
  ✅ 优化完成 (+27 字节)
优化: 从零学分析力学.md
  ✅ 优化完成 (+30 字节)
优化: 安装Sympy.md
  ✅ 优化完成 (+-109 字节)
优化: 建模理论问题.md
  ✅ 优化完成 (+30 字节)
优化: OSC2.md
  ✅ 优化完成 (+-55 字节)
优化: 编码器_1.md
  ✅ 优化完成 (+23 字节)
优化: kd树.md
  ✅ 优化完成 (+42 字节)
优化: 三维空间刚体运动.md
  ✅ 优化完成 (+63 字节)
优化: 2_二极管.md
  ✅ 优化完成 (+22 字节)
  进度: 190 个文件
优化: 3_晶体管的结构及符号.md
  ✅ 优化完成 (+22 字节)
优化: 4_放大的概念.md
  ✅ 优化完成 (+25 字节)
优化: 8_集成运放.md
  ✅ 优化完成 (+-5 字节)
优化: 1_数制和编码.md
  ✅ 优化完成 (+13 字节)
优化: LeetCode.md
  ✅ 优化完成 (+11 字节)
优化: 1_开始.md
  ✅ 优化完成 (+34 字节)
优化: CubeMax.md
  ✅ 优化完成 (+3 字节)
优化: PCB设计.md
  ✅ 优化完成 (+32 字节)
优化: 10_鼠标事件.md
  ✅ 优化完成 (+30 字节)
优化: 11_定时器.md
  ✅ 优化完成 (+31 字节)
  进度: 200 个文件
优化: 12_事件分发_过滤器.md
  ✅ 优化完成 (+31 字节)
优化: 13_绘图事件.md
  ✅ 优化完成 (+27 字节)
优化: 14_文件读取.md
  ✅ 优化完成 (+26 字节)
优化: 2_可视化ui设置.md
  ✅ 优化完成 (+18 字节)
优化: 朝花夕拾.md
  ✅ 优化完成 (+33 字节)
优化: 1_开始_1.md
  ✅ 优化完成 (+34 字节)
优化: 2_可视化ui设置_1.md
  ✅ 优化完成 (+18 字节)
优化: CubeMax_1.md
  ✅ 优化完成 (+3 字节)
优化: RM_HARWARE硬件接口.md
  ✅ 优化完成 (+22 字节)
优化: before reading.md
  ✅ 优化完成 (+51 字节)
  进度: 210 个文件
优化: command_sender.md
  ✅ 优化完成 (+51 字节)
优化: 校准队列.md
  ✅ 优化完成 (+47 字节)
优化: AverageFilter.md
  ✅ 优化完成 (+50 字节)
优化: MovingAverageFilter.md
  ✅ 优化完成 (+56 字节)
优化: RampFilter.md
  ✅ 优化完成 (+47 字节)
优化: filter.md
  ✅ 优化完成 (+45 字节)
优化: robot_state_interface.md
  ✅ 优化完成 (+59 字节)
优化: rm_dbus.md
  ✅ 优化完成 (+29 字节)
优化: before_reading.md
  ✅ 优化完成 (+51 字节)
优化: control_loop.md
  ✅ 优化完成 (+51 字节)
  进度: 220 个文件
优化: gpio_manager.md
  ✅ 优化完成 (+49 字节)
优化: hardware_interface.md
  ✅ 优化完成 (+55 字节)
优化: parse.md
  ✅ 优化完成 (+42 字节)
优化: rm_hw.md
  ✅ 优化完成 (+34 字节)
优化: Referee_dev.md
  ✅ 优化完成 (+12 字节)
优化: Referee操作手册.md
  ✅ 优化完成 (+25 字节)
优化: Referee移植.md
  ✅ 优化完成 (+-43 字节)
优化: super_capacity.md
  ✅ 优化完成 (+49 字节)
优化: Gimbal云台装置.md
  ✅ 优化完成 (+21 字节)
优化: calibration_controller.md
  ✅ 优化完成 (+52 字节)
  进度: 230 个文件
优化: chassis_controller.md
  ✅ 优化完成 (+41 字节)
优化: controller的创建(一).md
  ✅ 优化完成 (+29 字节)
优化: controller的创建(二).md
  ✅ 优化完成 (+30 字节)
优化: gimbal_controller.md
  ✅ 优化完成 (+16 字节)
优化: gpio_controller.md
  ✅ 优化完成 (+51 字节)
优化: orientation_controller.md
  ✅ 优化完成 (+59 字节)
优化: robot_state_controller.md
  ✅ 优化完成 (+24 字节)
优化: shooter_controller.md
  ✅ 优化完成 (+32 字节)
优化: manual.md
  ✅ 优化完成 (+32 字节)
优化: FSM状态机.md
  ✅ 优化完成 (+-17 字节)
  进度: 240 个文件
优化: offset大全.md
  ✅ 优化完成 (+46 字节)
优化: 调车流程及注意事项.md
  ✅ 优化完成 (+8 字节)
优化: 全覆盖路径.md
  ✅ 优化完成 (+50 字节)
优化: 行为树.md
  ✅ 优化完成 (+33 字节)
优化: Bug出现表.md
  ✅ 优化完成 (+-13 字节)
优化: Bullet发射装置.md
  ✅ 优化完成 (+19 字节)
优化: command.md
  ✅ 优化完成 (+45 字节)
优化: imu零飘补偿.md
  ✅ 优化完成 (+53 字节)
优化: yaw、pitch_pid调试.md
  ✅ 优化完成 (+59 字节)
优化: 一些便捷指令.md
  ✅ 优化完成 (+35 字节)
  进度: 250 个文件
优化: 切换显卡命令.md
  ✅ 优化完成 (+56 字节)
优化: 打前哨站.md
  ✅ 优化完成 (+50 字节)
优化: 拉取不是自己fork仓库的他人分支.md
  ✅ 优化完成 (+82 字节)
优化: 新拓展坞的IP设置.md
  ✅ 优化完成 (+62 字节)
优化: 新车流程.md
  ✅ 优化完成 (+50 字节)
优化: 最大力矩 最大转速计算.md
  ✅ 优化完成 (+69 字节)
优化: 有线调车.md
  ✅ 优化完成 (+50 字节)
优化: 测pitch上下限位.md
  ✅ 优化完成 (+58 字节)
优化: 自瞄_1.md
  ✅ 优化完成 (+45 字节)
优化: 调车测试整合.md
  ✅ 优化完成 (+-58 字节)
  进度: 260 个文件
优化: 跑仿真或实车.md
  ✅ 优化完成 (+56 字节)
优化: 远程遥控.md
  ✅ 优化完成 (+19 字节)
优化: Screenshot.md
  ✅ 优化完成 (+47 字节)
优化: 2023-04-20.md
  ✅ 优化完成 (+47 字节)
优化: 2024-01-28.md
  ✅ 优化完成 (+47 字节)
优化: PCB设计_1.md
  ✅ 优化完成 (+32 字节)
优化: README.md
  ✅ 优化完成 (+33 字节)
优化: 朝花夕拾_1.md
  ✅ 优化完成 (+33 字节)

📊 完成: 0/0 个文件已优化

优化目录: /root/.openclaw/workspace/As-my-see/notes
────────────
优化: 1_电信号.md
  ✅ 优化完成 (+19 字节)
优化: 1_信号.md
  ✅ 优化完成 (+12 字节)
优化: 2_阶跃信号与冲激信号.md
  ✅ 优化完成 (+24 字节)
优化: 3_系统.md
  ✅ 优化完成 (+19 字节)
优化: 1_信号_1.md
  ✅ 优化完成 (+12 字节)
优化: 2_阶跃信号与冲激信号_1.md
  ✅ 优化完成 (+24 字节)
优化: 3_系统_1.md
  ✅ 优化完成 (+19 字节)
优化: Referee裁判系统.md
  ✅ 优化完成 (+-41 字节)
优化: Manual操纵系统.md
  ✅ 优化完成 (+-32 字节)
优化: 查看系统日志.md
  ✅ 优化完成 (+56 字节)
  进度: 10 个文件
优化: LQR,MPC总结.md
  ✅ 优化完成 (+34 字节)
优化: 学习FAST-LIO2过程中补充基础知识.md
  ✅ 优化完成 (+79 字节)
优化: 人际学习.md
  ✅ 优化完成 (+27 字节)
优化: 未来学习.md
  ✅ 优化完成 (+12 字节)
优化: 哨兵学习.md
  ✅ 优化完成 (+-34 字节)
优化: 人际学习_1.md
  ✅ 优化完成 (+27 字节)
优化: 未来学习_1.md
  ✅ 优化完成 (+12 字节)
优化: 约束和拉格朗日方程.md
  ✅ 优化完成 (+12 字节)
优化: 数学建模.md
  ✅ 优化完成 (+21 字节)
优化: 易经.md
  ✅ 优化完成 (+32 字节)
  进度: 20 个文件
优化: 线性代数.md
  ✅ 优化完成 (+33 字节)
优化: 数学建模_1.md
  ✅ 优化完成 (+21 字节)
优化: 易经_1.md
  ✅ 优化完成 (+32 字节)
优化: 线性代数_1.md
  ✅ 优化完成 (+33 字节)
优化: 5_基本共射放大电路各元件的作用与工作原理.md
  ✅ 优化完成 (+25 字节)
优化: 6_放大电路的分析方法.md
  ✅ 优化完成 (+-22 字节)
优化: 7_多级放大电路.md
  ✅ 优化完成 (+20 字节)
优化: 9_放大电路的反馈.md
  ✅ 优化完成 (+33 字节)
优化: 第三章.md
  ✅ 优化完成 (+32 字节)
优化: 第三章_1.md
  ✅ 优化完成 (+32 字节)
  进度: 30 个文件

📊 完成: 0/0 个文件已优化

优化目录: /root/.openclaw/workspace/As-my-see/projects
────────────
优化: 建立小车.md
  ✅ 优化完成 (+31 字节)
优化: 教程案例——建立机械臂.md
  ✅ 优化完成 (+70 字节)
优化: 从零开始部署平衡开发环境和仿真（修改版本）.md
  ✅ 优化完成 (+20 字节)
优化: 快速部署电脑.md
  ✅ 优化完成 (+49 字节)
优化: QT项目开发需求.md
  ✅ 优化完成 (+33 字节)
优化: QT项目开发需求_1.md
  ✅ 优化完成 (+33 字节)

📊 完成: 0/0 个文件已优化

优化目录: /root/.openclaw/workspace/As-my-see/resources
────────────
优化: Ubuntu20.04配置ssh.md
  ✅ 优化完成 (+57 字节)
优化: Latex.md
  ✅ 优化完成 (+-42 字节)
优化: Markdown_公式块.md
  ✅ 优化完成 (+-31 字节)
优化: Python.md
  ✅ 优化完成 (+28 字节)
优化: 7_资源文件添加.md
  ✅ 优化完成 (+29 字节)
优化: 样式表.md
  ✅ 优化完成 (+30 字节)
优化: Markdown中如何实现内容折叠操作.md
  ✅ 优化完成 (+76 字节)
优化: 7_资源文件添加_1.md
  ✅ 优化完成 (+29 字节)
优化: 配置文件创建controllers.md
  ✅ 优化完成 (+31 字节)
优化: 新车网口配置.md
  ✅ 优化完成 (+56 字节)
  进度: 10 个文件
优化: Markdown中如何实现内容折叠操作_1.md
  ✅ 优化完成 (+78 字节)
优化: 样式表_1.md
  ✅ 优化完成 (+30 字节)

📊 完成: 0/0 个文件已优化

🚀 开始增强文档结构...
────────────────────
处理技术文档...
增强: 自定义rqt插件.md
  ✅ 结构增强完成
增强: 1_Qt.md
  ✅ 结构增强完成
增强: 3_Qt核心特点.md
  ✅ 结构增强完成
增强: 4_对象树.md
  ✅ 结构增强完成
增强: 5_Lambda表达式.md
  ✅ 结构增强完成
增强: C++多线程.md
  ✅ 结构增强完成
增强: C++游戏编程.md
  ✅ 结构增强完成
增强: C++游戏编程_1.md
  ✅ 结构增强完成
增强: Linux软链接、硬链接.md
  ✅ 结构增强完成
增强: Shell脚本.md
  ✅ 结构增强完成
增强: 内存寻址6_Linux中的分页.md
  ✅ 结构增强完成
增强: Fusion360脚本导出URDF.md
  ✅ 结构增强完成
增强: shell脚本.md
  ✅ 结构增强完成
增强: PID控制.md
  ✅ 结构增强完成
增强: 建立控制器.md
  ✅ 结构增强完成
增强: 开环控制算法.md
  ✅ 结构增强完成
增强: 机器人路径规划与轨迹优化.md
  ✅ 结构增强完成
增强: GM6020云台电机.md
  ✅ 结构增强完成
增强: ROS学习.md
  ✅ 结构增强完成
增强: ROS激光雷达建图导航.md
  ✅ 结构增强完成
增强: ROS激光雷达建图导航2.md
  ✅ 结构增强完成
增强: ROS编程.md
  ✅ 结构增强完成
增强: ROS通信_dev.md
  ✅ 结构增强完成
增强: 形态学处理.md
  ✅ 结构增强完成
增强: 色彩分割.md
  ✅ 结构增强完成
增强: Socketcan.md
  ✅ 结构增强完成
增强: CAN命令.md
  ✅ 结构增强完成
增强: CAN总线 1.md
  ✅ 结构增强完成
增强: CAN编程(2).md
  ✅ 结构增强完成
增强: CAN编程.md
  ✅ 结构增强完成

处理学习笔记...
增强: 1_电信号.md
  ✅ 结构增强完成
增强: 1_信号.md
  ✅ 结构增强完成
增强: 2_阶跃信号与冲激信号.md
  ✅ 结构增强完成
增强: LQR,MPC总结.md
  ✅ 结构增强完成
增强: 学习FAST-LIO2过程中补充基础知识.md
  ✅ 结构增强完成
增强: 人际学习.md
  ✅ 结构增强完成
增强: 约束和拉格朗日方程.md
  ✅ 结构增强完成
增强: 数学建模.md
  ✅ 结构增强完成
增强: 易经.md
  ✅ 结构增强完成
增强: 5_基本共射放大电路各元件的作用与工作原理.md
  ✅ 结构增强完成
增强: 6_放大电路的分析方法.md
  ✅ 结构增强完成
增强: 7_多级放大电路.md
  ✅ 结构增强完成

✅ 文档结构增强完成

📊 优化完成报告
──────────────
报告时间: Fri Feb 27 02:04:34 PM CST 2026

📁 文档分布统计:
  docs/: 268 个文档
  notes/: 30 个文档
  projects/: 6 个文档
  resources/: 12 个文档

📋 优化示例:

📈 总计:  个文档已就绪
🎉 优化阶段完成!

✅ 文档内容优化完成!
下一步: 知识扩展和网络搜索补充
